"Website","Tags","Service Provider","Info_Phishing","Info_C&C","Info_Exfiltration","Info_Download","Info_Sample","is_legit"
"api.telegram.org","[''C&C''-|-''Exfiltration'']","Telegram","None","Telegram is being increasingly used as a C&C server by attackers. CheckPoint reported that a Remote Access Trojan, ToxicEye, used Telegram for C&C. One additional benefit of using Telegram as a C&C server is it allows attackers to use their mobile device to access infected machines.","Data can be exfiltrated onto Telegram by using a bot controlled by the attacker and sending it the data as a private message. This was demonstrated by SecurityBoulevard.","None","None","false"
"*.gofile.io","[''Phishing''-|-''Exfiltration''-|-''Download'']","Gofile","Malicious files can be uploaded on gofile.io and then have the direct link shared with targets in phishing attacks.","None","Attackers can upload data to gofile.io and share the link to themselves to download the exfiltrated data.","Attackers can keep their tools stored on gofile.io and when required, use the direct download link to fetch the tools.","https://www.hybrid-analysis.com/sample/345ee78ba847b524532e2844efe9e838fdff05a83cfdecb7b1e80a1e57dd2cf8/61859856ce4d9f692c5caee2","false"
"*.instagram.com","[''Phishing''-|-''C&C'']","Facebook","Attackers can use the l.instagram.com subdomain to redirect users to an external URL. Although Instagram scans the URL (which can be bypassed by using a URL shortening service) and includes a time-based token to reduce the chances of abuse.","The Instagram API can be used to make Instagram a C&C server. An open source tool ""Social-media-c2"" uses the like functionality on Instagram to send commands to infected machines.","None","None","None","false"
"facebook.com","[''C&C'']","Facebook","None","Facebook can be used as a C&C server by attackers by publishing posts that contain commands and then having the infected machines fetch them.","None","None","None","false"
"*.glitch.me","[''Phishing''-|-''Download'']","Glitch","Attackers can use a customized subdomain of glitch.me to host their phishing websites.","None","None","Malicious tools can be stored on *.glitch.me and downloaded when required.","https://www.joesandbox.com/analysis/515940/0/html","false"
"bit.ly","[''Phishing''-|-''Download'']","Bitly Inc.","Attackers can use the URL shortener, bit.ly, to masquerade their domain name and send the shortened link to their targets.","None","None","Malicious tools can be stored on an attacker's domain and then have the URL shortened. When the tools are needed, the shortened URL is used to download the tools.","https://www.joesandbox.com/analysis/519951/0/html","false"
"*.trycloudflare.com","[''Phishing''-|-''Download'']","Cloudflare","Attackers can use the try.cloudflare.com service to get a subdomain on *.trycloudflare.com. The service works similarly to Ngrok and allows attackers to expose a local web server to the internet. Attackers abuse this functionality to expose malicious servers on a *.trycloudflare.com subdomain.","None","None","Malicious tools can be stored on an attacker's local web server. The local web server is then exposed to the internet on a *.trycloudflare.com subdomain and when the tools are needed, the link is used to download the tools.","https://www.hybrid-analysis.com/sample/9bffaa52ff450bad0bb52382766d03e77e84b25a200343a74581f3ecde48ab02/616f0ddce60c3a232b7b17cd","false"
"beautiful.ai","[''Phishing'']","Beautiful.ai","Attackers can create a presentation on beautiful.ai with embedded links that redirect to malicious domains and then share the presentation to target users.","None","None","None","https://www.joesandbox.com/analysis/496632/0/html","false"
"siasky.net","[''Phishing''-|-''Exfiltration''-|-''Download'']","Siasky","Attackers can upload malicious files to siasky.net and then share the direct download link with targets.","None","Attackers can upload data to siasky.net and share the link to themselves to download the exfiltrated data.","Attackers can keep their tools stored on siasky.net and when required, use the direct download link to fetch the tools.","https://www.joesandbox.com/analysis/472610/0/html","false"
"*.clickfunnels.com","[''Phishing'']","ClickFunnels","Attackers can use a personalized subdomain from clickfunnels.com to create a phishing page with embedded links to malicious domains.","None","None","None","https://www.joesandbox.com/analysis/504403/0/html","false"
"*.docusign.com","[''Phishing'']","DocuSign","Attackers have used DocuSign to phish users and redirect them to malicious domains.","None","None","None","None","false"
"*.digitaloceanspaces.com","[''Phishing''-|-''Download''-|-''Exfiltration''-|-''C&C'']","DigitalOcean","DigitalOcean allows users to create a customized subdomain on digitaloceanspaces.com. Attackers abuse this functionality by hosting phishing websites.","*.digitaloceanspaces.com subdomains can be used as C&C servers.","Attackers can upload exfiltrated data onto applications hosted on *.digitaloceanspaces.com","Attackers can host malicious tools on *.digitaloceanspaces.com and download them when required.","https://www.joesandbox.com/analysis/495306/0/html","false"
"*.godaddysites.com","[''Phishing''-|-''C&C'']","GoDaddy","GoDaddy allows users to create a customized subdomain on godaddysites.com. Attackers abuse this functionality by hosting phishing websites.","*.godaddysites.com subdomains can be used as C&C servers.","None","None","https://www.joesandbox.com/analysis/448978/0/html","false"
"*.weebly.com","[''Phishing''-|-''C&C'']","Weebly","Weebly allows users to create a customized subdomain on weebly.com. Attackers abuse this functionality by hosting phishing websites.","Attackers can use *.weebly.com and C&C servers.","None","None","https://www.joesandbox.com/analysis/520782/0/html","false"
"www.canva.com","[''Phishing'']","Canva","Attackers have abused Canva by creating a custom image with embedded links that redirects targets to malicious a domain.","None","None","None","https://www.joesandbox.com/analysis/520209/0/html","false"
"t.co","[''Phishing''-|-''C&C'']","Twitter","Attackers can use Twitter's short URL to masquerade their domain name and then send the shortened link to their targets. Twitter attempts to prevent abuse of their shortened URL by scanning domains being shortened.","Twitter's shortened URL, t.co, can be used for C&C purposes.","None","None","None","false"
"*.mybluemix.net","[''Phishing''-|-''Download''-|-''C&C'']","IBM","Attackers can use *.mybluemix.net to host their phishing websites. They can be used for credential harvesting or redirecting users to a malicious websites.","Attackers can use *.mybluemix.net for C&C purposes.","None","Malicious tools can be stored on *.mybluemix.net and downloaded when required.","https://www.joesandbox.com/analysis/483345/0/html","false"
"appdomain.cloud","[''Phishing''-|-''Download''-|-''C&C''-|-''Exfiltration'']","IBM","Attackers can use a *.appdomain.cloud subdomain to host their phishing websites. They can be used for credential harvesting or redirecting users to a malicious websites.","Attackers can use *.appdomain.cloud for C&C purposes.","Attackers can use *.appdomain.cloud as storage and upload exfiltrated files there.","Malicious tools can be stored on *.appdomain.cloud and downloaded when required.","https://www.joesandbox.com/analysis/496810/0/html","false"
"archive.org","[''Phishing''-|-''Download'']","Archive.org","Attackers can create a phishing website and then use archive.org to hide their domain.","None","None","Malicious tools can be uploaded on archive.org and then downloaded when needed.","https://www.joesandbox.com/analysis/447280/0/html","false"
"spark.adobe.com","[''Phishing''-|-''C&C'']","Adobe","Attackers can use spark.adobe.com to create websites with embedded links that redirect target users to malicious websites.","Attackers can use spark.adobe.com for C&C purposes.","None","None","https://www.joesandbox.com/analysis/515360/0/html","false"
"*.atlassian.net","[''Phishing''-|-''C&C'']","Atlassian","Attackers can use a *.atlassian.net subdomain that contains embedded links to redirect users to malicious websites.","Attackers can use *.atlassian.net for C&C purposes.","None","None","https://www.joesandbox.com/analysis/465095/0/html","false"
"dogechain.info","[''C&C'']","Dogechain.info","None","The Doki malware has abused dogechain.info API for C&C purposes.","None","None","https://www.zdnet.com/article/new-linux-malware-uses-dogecoin-api-to-find-c-c-server-addresses/","false"
"paste.ee","[''C&C''-|-''Exfiltration''-|-''Download'']","Paste.ee","None","Paste.ee can be used for C&C purposes. The attacker can place the commands in Paste.ee and have the malware fetch the commands.","Attackers will upload sensitive data onto Paste.ee and share the link with themselves for later access.","Attackers upload the source code of tools onto Paste.ee and download them when necessary.","https://www.gdatasoftware.com/blog/netwire-rat-via-pasteee-and-ms-excel","false"
"gitee.com","[''C&C''-|-''Download'']","Gitee.com","None","Similiar to Github, Gitee.com can have files uploaded with commands and have the malware fetch those commands.","None","Attackers upload tools onto Gitee.com and download them when needed.","None","false"
"*.rf.gd","[''Phishing''-|-''C&C'']","InfinityFree","Attackers can use a *.rf.gd subdomain to host their phishing websites.","Attackers can use *.rf.gd for C&C purposes.","None","None","https://www.joesandbox.com/analysis/393127/0/html","false"
"viewer.joomag.com","[''Phishing'']","Joomag","Attackers can use viewer.joomag.com to create digital content which contains embedded links to malicious websites.","None","None","None","https://www.joesandbox.com/analysis/498354/0/html","false"
"my.visme.co","[''Phishing'']","Visme","Attackers can use my.visme.co to create digital content which contains embedded links to malicious websites.","None","None","None","https://www.joesandbox.com/analysis/467704/0/html","false"
"archive.ph","[''Phishing''-|-''Download'']","Archive.ph","Attackers can create a phishing website and then use archive.ph to hide their domain.","None","None","Malicious tools can be uploaded on archive.ph and then downloaded when needed.","None","false"
"docsend.com","[''Phishing'']","Docsend","Attackers can use Docsend to phish users and redirect them malicious domains.","None","None","None","https://www.joesandbox.com/analysis/524724/0/html","false"
"*.nimbusweb.me","[''Phishing'']","Nimbus Note","Attackers can use *.nimbusweb.me to share notes that contain embedded links to malicious websites.","None","None","None","https://www.joesandbox.com/analysis/467104/0/html","false"
"*.oraclecloud.com","[''Phishing''-|-''Exfiltration''-|-''Download''-|-''C&C'']","Oracle","Attackers can use a *.oraclecloud.com subdomain to host their phishing websites.","Attackers can use *.oraclecloud.com for C&C purposes.","Attackers can use Oracle Object Storage to upload exfiltrated files there.","Attackers can store malicious tools on Oracle Object Storage and download them when needed.","https://www.joesandbox.com/analysis/499112/0/html","false"
"*.azurefd.net","[''Phishing''-|-''C&C'']","Microsoft","Attackers can use a subdomain from Azure Front Door (*.azurefd.net) to host their phishing websites.","Attackers can use *.azurefd.net for C&C purposes.","None","None","https://www.joesandbox.com/analysis/524563/0/html","false"
"parg.co","[''Phishing''-|-''Download'']","Parg.co","Attackers can use the URL shortener, parg.co, to masquerade their domain name and send the shortened link to their targets.","None","None","Malicious tools can be stored on an attacker's domain and then have the URL shortened. When the tools are needed, the shortened URL is used to download the tools.","https://www.joesandbox.com/analysis/282950/0/html","false"
"*.ngrok.io","[''Phishing''-|-''C&C''-|-''Exfiltration''-|-''Download'']","Ngrok","Attackers can use a subdomain hosted on *.ngrok.io to host their phishing website.","Attackers can use *.ngrok.io for C&C purposes.","Attackers can upload files on websites hosted on *.ngrok.io.","Malicious tools can be stored on an attacker's domain and then have it hidden behind *.ngrok.io and used to download files when needed.","https://www.joesandbox.com/analysis/308696/0/html","false"
"codepen.io","[''C&C''-|-''Download'']","CodePen","None","Attackers can use codepen.io to execute JavaScript and establish a websocket connection to a remote C&C server. An example is available thanks to @fkadibs: https://codepen.io/fkadibs/pen/KKvrZGq","None","Attackers can use codepen.io to download malicious tools. Although the attacker cannot download binaries directly, one method of doing so is by first base64 encoding the binary then adding it to the HTML section of a pen and then downloading decoding the binary.","None","false"
"pastetext.net","[''Download'']","Pastetext.net","None","None","None","Attackers upload the source code of tools onto pastetext.net and download them when necessary.","https://twitter.com/pr0xylife/status/1439897347757121540","false"
"notion.so","[''Phishing''-|-''C&C''-|-''Exfiltration''-|-''Download'']","Notion.so","Attackers can use notion.so to share files with embedded malicious links or documents","Attackers can use notion.so for C&C purposes. OffensiveNotion is an open-source tool that utilizes notion.so for C&C.","Attackers can use notion.so for to exfiltrate data. OffensiveNotion is an open-source tool that can use notion.so to exfiltrate data.","Attackers can use notion.so for to download files. OffensiveNotion is an open-source tool that can use notion.so to download files.","https://github.com/mttaggart/OffensiveNotion","false"
"*.wixsite.com","[''Phishing'']","Wix","Attackers can use a subdomain hosted on *.wixsite.com to host their phishing website.","None","None","None","https://www.joesandbox.com/analysis/509353/0/html","false"
"attachment.outlook.live.net","[''Phishing''-|-''Download''-|-''Exfiltration'']","Microsoft","Attackers can compose an email, attach a file and use the direct download link to phish users. The caveat with using this method is the phishing link expires in approximately 15 minutes.","None","Attackers can compose an email, attach file(s) to exfiltrate and send the download link to themselves. This method is not ideal for large files due to the file size restriction in place.","Attackers can compose an email on Outlook and attach a file and then use the file's download link to directly download the file. Restricted file types would first need to have their file extension modified (e.g. mimikatz.exe becomes mimikatz.exe.txt) and then upon download the file extension is modified back to the original extension.","https://twitter.com/mrd0x/status/1462852381830524931","false"
"attachments.office.net","[''Phishing''-|-''Download''-|-''Exfiltration'']","Microsoft","Attackers can compose an email, attach a file and use the direct download link to phish users. The caveat with using this method is the phishing link expires in approximately 15 minutes.","None","Attackers can compose an email, attach file(s) to exfiltrate and send the download link to themselves. This method is not ideal for large files due to the file size restriction in place.","Attackers can compose an email on O365 and attach a file and then use the file's download link to directly download the file. Restricted file types would first need to have their file extension modified (e.g. mimikatz.exe becomes mimikatz.exe.txt) and then upon download the file extension is modified back to the original extension.","https://twitter.com/mrd0x/status/1462852381830524931","false"
"lnkd.in","[''Phishing''-|-''Download'']","Microsoft","Attackers can use LinkedIn's short URL to masquerade their domain name and then send the shortened link to their targets.","None","None","Malicious tools can be stored on an attacker's domain and then have the URL shortened. When the tools are needed, the shortened URL is used to download the tools.","https://www.joesandbox.com/analysis/524661/0/html","false"
"*.myportfolio.com","[''Phishing'']","Adobe","Attackers can use a personalized subdomain from myportfolio.com to create a phishing page with embedded links that leads to malicious domains.","None","None","None","https://www.joesandbox.com/analysis/517898/0/html","false"
"*.notion.site","[''Phishing''-|-''Download'']","Notion.so","Attackers can host a malicious file onto their notion page, make it public, and then share the download link of the file to target users. Note that Notion restricts certain file types.","None","None","Attackers can host a malicious file onto their notion page, make it public, and then use the download link to drop files onto a target machine.","https://www.joesandbox.com/analysis/532127/0/html","false"
"*.wasabisys.com","[''Phishing''-|-''C&C''-|-''Exfiltration''-|-''Download'']","Wasabi Technologies","Attackers can use *.wasabisys.com to host phishing templates.","Attackers can use *.wasabisys.com for C&C purposes.","Wasabisys' S3 storage capabilities can be used to store exfiltrated files on there.","Malicious tools can be stored on *.wasabisys.com and downloaded when required.","https://www.joesandbox.com/analysis/494841/0/html","false"
"rebrand.ly","[''Phishing''-|-''Download'']","Rebrandly","Attackers can use the URL shortener, rebrand.ly, to masquerade their domain name and send the shortened link to their targets.","None","None","Malicious tools can be stored on an attacker's domain and then have the URL shortened. When the tools are needed, the shortened URL is used to download the tools.","https://www.joesandbox.com/analysis/525322/0/html","false"
"rb.gy","[''Phishing''-|-''Download'']","Rebrandly","Attackers can use the URL shortener, rb.gy, to masquerade their domain name and send the shortened link to their targets.","None","None","Malicious tools can be stored on an attacker's domain and then have the URL shortened. When the tools are needed, the shortened URL is used to download the tools.","https://www.joesandbox.com/analysis/527289/0/html","false"
"genius.com","[''C&C'']","Genius","None","Attackers are using genius.com for C&C purposes by posting commands in the biography section of user profiles.","None","None","None","false"
"inmotionhosting.com","[''Phishing''-|-''C&C''-|-''Exfiltration''-|-''Download'']","InMotion Hosting","Attackers can use *.inmotionhosting.com to host phishing websites.","Attackers can use servers hosted on *.inmotionhosting.com for C&C purposes.","Attackers can create web applications with upload functionalities hosted on *.inmotionhosting.com and exfiltrate data on there.","Attackers can host malicious tools on applications hosted on *.inmotionhosting.com and download them when needed.","https://www.joesandbox.com/analysis/513058/0/html","false"
"stonly.com","[''Phishing'']","Stonly","Attackers have abused Stonly by creating custom pages with embedded links that redirect to phishing websites.","None","None","None","https://www.joesandbox.com/analysis/533718/0/html","false"
"*.csb.app","[''Phishing'']","CodeSandbox","Attackers can create phishing templates on *.csb.app and share the link with targets.","None","None","None","https://www.joesandbox.com/analysis/497495/0/html","false"
"*.codesandbox.io","[''Phishing'']","CodeSandbox","Attackers can create phishing templates on *.codesandbox.io and share the link with targets.","None","None","None","https://www.joesandbox.com/analysis/533441/0/html","false"
"*.000webhostapp.com","[''Phishing''-|-''C&C''-|-''Exfiltration''-|-''Download'']","Hostinger","Attackers can use *.000webhostapp.com to host phishing websites.","Attackers have used *.000webhostapp.com domains for C&C purposes.","Attackers can exfiltrate files onto *.000webhostapp.com via file manager capabilities.","Malicious tools can be stored on *.000webhostapp.com and downloaded when required.","https://www.joesandbox.com/analysis/339155/0/html","false"
"*.hostingerapp.com","[''Phishing''-|-''C&C''-|-''Exfiltration''-|-''Download'']","Hostinger","Attackers can use *.hostingerapp.com to host phishing websites.","Attackers have used *.hostingerapp.com domains for C&C purposes.","Attackers can exfiltrate files onto *.hostingerapp.com via file manager capabilities.","Malicious tools can be stored on *.hostingerapp.com and downloaded when required.","https://www.joesandbox.com/analysis/380310/0/html","false"
"feedproxy.google.com","[''Phishing'']","Google","Attackers can use feedproxy.google.com to redirect targets to a malicious domain.","None","None","None","https://www.joesandbox.com/analysis/505859/0/html","false"
"*.pagecloud.com","[''Phishing'']","PageCloud","Attackers can use *.pagecloud.com to create a phishing page with embedded links that redirects users to a malicious site or downloads a malicious file.","None","None","None","https://www.joesandbox.com/analysis/423120/0/html","false"
"*.format.com","[''Phishing'']","Format","Attackers can use *.format.com to create a phishing page with embedded links that redirects users to a malicious site or downloads a malicious file.","None","None","None","https://www.joesandbox.com/analysis/416730/0/html","false"
"s.id","[''Phishing''-|-''Download'']","s.id","Attackers can use the URL shortener, s.id, to masquerade their domain name and send the shortened link to their targets.","None","None","Malicious tools can be stored on an attacker's domain and then have the URL shortened. When the tools are needed, the shortened URL is used to download the tools.","https://www.joesandbox.com/analysis/517911/0/html","false"
"doc.clickup.com","[''Phishing'']","ClickUp","Attackers can use doc.clickup.com to create a phishing page with embedded links or attachments.","None","None","None","https://www.joesandbox.com/analysis/513883/0/html","false"
"ufile.io","[''Phishing''-|-''Exfiltration''-|-''Download'']","Ufile","Malicious files can be uploaded on ufile.io and then have the direct link shared with targets in phishing attacks.","None","Attackers can upload data to ufile.io and share the link to themselves to download the exfiltrated data.","Attackers can keep their tools stored on ufile.io and when required, use the direct download link to fetch the tools.","None","false"
"onenoteonlinesync.onenote.com","[''Phishing''-|-''Download''-|-''Exfiltration'']","Microsoft","Attackers can insert an attachment on a OneNote Notebook and then use the attachment's direct download link to phish users.","None","Attackers can insert files they wish to exfiltrate on a OneNote Notebook and send the direct download link to themselves. This method is not ideal for large files due to the file size restriction in place.","Attackers can insert an attachment on a OneNote Notebook and then use the attachment's download link to directly download the file.","https://twitter.com/mrd0x/status/1475085452784844803","false"
"12ft.io","[''Phishing'']","12ft.io","Attackers can use 12ft.io to masquerade their domain for phishing purposes. The URL will have the following structure: 12ft.io/proxy?q=phishing-site[.]com","None","None","None","https://twitter.com/mrd0x/status/1475645195874185216","false"
"*.doubleclick.net","[''Phishing''-|-''Download'']","Google","Attackers can use *.doubleclick.net to redirect targets to a malicious domain.","None","None","Attackers can use *.doubleclick.net to masquerade a direct download link.","https://www.joesandbox.com/analysis/484852/0/html","false"
"t.m1.email.samsung.com","[''Phishing''-|-''Download'']","Samsung","Attackers can use t.m1.email.samsung.com to redirect targets to a malicious domain. The format of the link would be as follows: https://t.m1.email.samsung.com/r/?id=hdbbbab34,71b0ad58,6b55baa5&p1=[phishing-link]","None","None","Attackers can use t.m1.email.samsung.com to masquerade a direct download link.","https://www.joesandbox.com/analysis/545632/0/html","false"
"*.repl.co","[''Phishing''-|-''C&C''-|-''Exfiltration''-|-''Download'']","Replit","Attackers can use *.repl.co to host their phishing websites.","Attackers can use a customized subdomain of repl.co as their C&C server.","Attackers can add upload functionalities hosted on *.repl.co and exfiltrate data on there.","Attackers can host their malicious tools on an external provider and then use *.repl.co to fetch the files.","https://www.joesandbox.com/analysis/487279/0/html","false"
"teletype.in","[''Phishing'']","Teletype","Attackers can use teletype.in to create a phishing page with embedded links that redirects users to a malicious site or downloads a malicious file.","None","None","None","https://www.hybrid-analysis.com/sample/b897d347e9fa7f668b0c15069360d6a5846bb6a22744891ff6cef7c0a8026561/60041f6f7ad0392bd82aab6f","false"
"*.easywp.com","[''Phishing'']","EasyWP","Attackers can use *.easywp.com to create a phishing page with embedded links that redirects users to a malicious site or downloads a malicious file.","None","None","None","https://www.joesandbox.com/analysis/545565/0/html","false"
"telegra.ph","[''Phishing'']","Telegraph","Attackers can use telegra.ph to create a phishing page with embedded links that redirects users to a malicious site or downloads a malicious file.","None","None","None","https://www.joesandbox.com/analysis/244952/0/html","false"
"filebin.net","[''Phishing''-|-''Exfiltration''-|-''Download'']","Filebin","Attackers can upload malicious files to filebin.net and share the direct download link to users.","None","Attackers can upload data to filebin.net and share the link to themselves to download the exfiltrated data. Requires GUI access.","Attackers can keep their tools stored on filebin.net and when required, use the custom link to download.","https://www.joesandbox.com/analysis/285132/0/html","false"
"*.fyi.to","[''Phishing'']","FYI.to","Attackers can use *.fyi.to to share malicious links with target users.","None","None","None","None","false"
